ID,平台,用户昵称,用户等级,评论内容,评分,日期,SKU,追加评论,追加日期,有图片,商家回复
r_1771737727482_442,tmall,**,,s**42025年8月3日已购：JPCD12E-NT01S 14套 黑色00尺寸合适，不过洗完烘干保存，机子内壁还是会有点水珠商家回复：在这漫长人生旅途中与您相逢，本身就是一种幸福。我们祈愿所有美好事物都能伴随您左右。衷心感谢您对我们团队的认可，我们相信他们会持续精进技艺，为您带来更加卓越的服务。我们深信，追求卓越永无止境，我们将以更优质的产品和服务回馈我们深爱的顾客。更多,5,2025年8月3,,,,否,在这漫长人生旅途中与您相逢，本身就是一种幸福。我们祈愿所有美好事物都能伴随您左右。衷心感谢您对我们团队的认可，我们相信他们会持续精进技艺，为您带来更加卓越的服务。我们深信，追求卓越永无止境，我们将以更优质的产品和服务回馈我们深爱的顾客。更多
r_1771737727482_443,tmall,**,,S**y2025年3月8日已购：JPCD6E-02-B-NF1 13套 白色12产品目前用着还行，安装费又加了将近8百，说是可以报销最高500，但是没想到是以话费的形式，大家这点需要注意哈！商家回复：亲爱的顾客，衷心感谢您的惠顾与信任！我们产品都是精心设计的，您可以放心使用哦~感谢您的反馈，我们会不断优化产品和服务，期待能给您带来更好的体验！今后使用中有任何问题都可以联系我们在线客服哦！更多3天后追评：好嘛，好说歹说100原路退，剩下的400说分批充两个号码，一个充了250，你家是会阴阳怪气的，避雷！！😡😡😡玩什么文字游戏避重就轻的，不会再买你家产品了😡😡😡商家回复：尊敬的顾客，您先消消气~关于您反馈的问题，我们深感抱歉，已安排专业的售后人员跟进处理，期待能够挽回您的购物体验！同时我们也会进行核实，若存在问题定会严肃处理，不断优化和改善流程，提升用户体验。再次为给您造成的不便表示歉意，祝您生活愉快~更多,5,2025年3月8,,好嘛，好说歹说100原路退，剩下的400说分批充两个号码，一个充了250，你家是会阴阳怪气的，避雷！！😡😡😡玩什么文字游戏避重就轻的，不会再买你家产品了😡😡😡商家回复：尊敬的顾客，您先消消气~关于您反馈的问题，我们深感抱歉，已安排专业的售后人员跟进处理，期待能够挽回您的购物体验！同时我们也会进行核实，若存在问题定会严肃处理，不断优化和改善流程，提升用户体验。再次为给您造成的不便表示歉意，祝您生活愉快~更多,,否,亲爱的顾客，衷心感谢您的惠顾与信任！我们产品都是精心设计的，您可以放心使用哦~感谢您的反馈，我们会不断优化产品和服务，期待能给您带来更好的体验！今后使用中有任何问题都可以联系我们在线客服哦！更多3天后追评：好嘛，好说歹说100原路退，剩下的400说分批充两个号码，一个充了250，你家是会阴阳怪气的，避雷！！😡😡😡玩什么文字游戏避重就轻的，不会再买你家产品了😡😡😡商家回复：尊敬的顾客，您先消消气~关于您反馈的问题，我们深感抱歉，已安排专业的售后人员跟进处理，期待能够挽回您的购物体验！同时我们也会进行核实，若存在问题定会严肃处理，不断优化和改善流程，提升用户体验。再次为给您造成的不便表示歉意，祝您生活愉快~更多
r_1771737727482_444,tmall,于**闯,,于**闯2025年3月8日已购：JPCD12E-NT01S 13套 黑色3131颜值挺高的，我家是加装，本身厨房有很多问题，师傅和客服都帮我想办法，最后安装成这样，我很满意，我家的抽油烟机和燃气灶都是方太的，容量也够，我们两个人用了。清洁力还没有试，等试后了再来追评清洁很好商家回复：非常感谢太粉的宝贵评价！我们期待您体验之后的分享哦，希望可以得到您的认可。觉得好用的话，就多分享下您的感受和心得，多多推荐给亲朋好友。 更多,5,2025年3月8,,清洁很好商家回复：非常感谢太粉的宝贵评价！我们期待您体验之后的分享哦，希望可以得到您的认可。觉得好用的话，就多分享下您的感受和心得，多多推荐给亲朋好友。 更多,,否,非常感谢太粉的宝贵评价！我们期待您体验之后的分享哦，希望可以得到您的认可。觉得好用的话，就多分享下您的感受和心得，多多推荐给亲朋好友。 更多
r_1771737727482_445,tmall,一**楼,,一**楼2024年11月27日已购：JPCD12E-NT01S 13套 黑色00该用户未填写评价内容29天后追评：好商家回复：感谢太粉的选择，短短的几个字我们也可以开心很久，我们一直希望能做好产品和服务，让大家认可，觉得值，也许这就够了。成长路上有您的支持一定会更加的优秀，也会更加用心的服务好每一位选择我们的买家。 更多,5,2024年11月27,,好商家回复：感谢太粉的选择，短短的几个字我们也可以开心很久，我们一直希望能做好产品和服务，让大家认可，觉得值，也许这就够了。成长路上有您的支持一定会更加的优秀，也会更加用心的服务好每一位选择我们的买家。 更多,,否,感谢太粉的选择，短短的几个字我们也可以开心很久，我们一直希望能做好产品和服务，让大家认可，觉得值，也许这就够了。成长路上有您的支持一定会更加的优秀，也会更加用心的服务好每一位选择我们的买家。 更多
r_1771737727482_446,tmall,,,匿名买家2024年3月13日已购：白色00该用户觉得商品非常好，给出5星好评清洁很好,5,2024年3月13,,,,否,
r_1771737727482_447,tmall,一**花,,一**花2024年8月27日已购：JPCD12E-NT01S 13套 黑色09机器很不错，客服山竹同学很好，安装师傅也很好清洁很好商家回复：谢谢亲爱的对我们方太的支持，您的赞美给予了我们极大的鼓励，往后小店将一如既往的为您提供好的服务体验，确保您售后无忧~ 更多,5,2024年8月27,,,,否,谢谢亲爱的对我们方太的支持，您的赞美给予了我们极大的鼓励，往后小店将一如既往的为您提供好的服务体验，确保您售后无忧~ 更多
r_1771737727482_448,tmall,尺寸刚好给**作台下嵌入式,,匿名买家2025年6月23日已购：JPCD12E-NT01S 14套 黑色08声音大小：还没拆呢，千挑万选出来的 其他特色：尺寸刚好给**作台下嵌入式 用了再来追平 清洁很好商家回复：感谢太粉的选择~当您把信任交予给我们的时候，我们相信您买到的不只是一件商品，更多的是一份保障，一份品位。后续有任何问题都可以随时联系我们哦~更多,5,2025年6月23,,,,否,感谢太粉的选择~当您把信任交予给我们的时候，我们相信您买到的不只是一件商品，更多的是一份保障，一份品位。后续有任何问题都可以随时联系我们哦~更多
r_1771737727482_449,tmall,,,匿名买家2024年5月8日已购：JPCD6E-02-B-NF1 13套 白色03清洁效果：用了一次云清洗 30分钟，碗里还有很多水，但洗的挺干净，透亮。 安装：上门安装速度快，收费透明，客服说有改造补贴，但还未收到。 下单体验：服务一般，各种客服让加微信，一会说下单就送清洗用品，收到货没有赠品，又说要晒图才赠送。商家回复：亲爱的，收到您的反馈，我们十分的重视，很抱歉给您带来困扰~关于客服人员服务问题，已反馈相关部门加强整顿和培训，提高服务品质。若后期有其他问题可随时联系我们，感谢您的支持与监督！欢迎您再次光临我们的店铺，检验我们的进步！ 更多,5,2024年5月8,,,,否,亲爱的，收到您的反馈，我们十分的重视，很抱歉给您带来困扰~关于客服人员服务问题，已反馈相关部门加强整顿和培训，提高服务品质。若后期有其他问题可随时联系我们，感谢您的支持与监督！欢迎您再次光临我们的店铺，检验我们的进步！ 更多
r_1771737727482_450,tmall,愁**,,愁**12024年8月9日已购：JPCD6E-02-B-NF1 13套 白色013该用户未填写评价内容29天后追评：13件套挺适合我家一家三口商家回复：清风带给我的喜悦感来源于您对我们的支持与肯定！不需要最贵也不选最便宜，只选最合适的，只因一切适合自己的东西才是最好的，相信您已经找到了那份合适呢~后续您使用有任何问题欢迎进线找客服或拨打热线952315哦o(*￣▽￣*)ブ 更多,5,2024年8月9,,13件套挺适合我家一家三口商家回复：清风带给我的喜悦感来源于您对我们的支持与肯定！不需要最贵也不选最便宜，只选最合适的，只因一切适合自己的东西才是最好的，相信您已经找到了那份合适呢~后续您使用有任何问题欢迎进线找客服或拨打热线952315哦o(*￣▽￣*)ブ 更多,,否,清风带给我的喜悦感来源于您对我们的支持与肯定！不需要最贵也不选最便宜，只选最合适的，只因一切适合自己的东西才是最好的，相信您已经找到了那份合适呢~后续您使用有任何问题欢迎进线找客服或拨打热线952315哦o(*￣▽￣*)ブ 更多
r_1771737727482_451,tmall,,,匿名买家2025年6月1日已购：JPCD12E-NT01S 14套 黑色01声音大小:跟微波炉声音差不多，很小声音 清洗容量:可以洗中式大不锈钢炒锅，省太多力了 其他特色:链接手机还有比面板更多的洗涤选项，特别是单独的下层清洗，更省水商家回复：喜欢就好，遇到合适的品牌，选到喜欢的产品，确实是令人开心的事。 您把信任交予给我们的时候，我们相信您买到的不只是一件商品，更多的是一份保障，一份品位。 期待与您再次相遇！更多,5,2025年6月1,,,,否,喜欢就好，遇到合适的品牌，选到喜欢的产品，确实是令人开心的事。 您把信任交予给我们的时候，我们相信您买到的不只是一件商品，更多的是一份保障，一份品位。 期待与您再次相遇！更多
r_1771737727482_452,tmall,**,,z**42025年8月13日已购：JPCD12E-NT01S 14套 黑色02厨房电器这一块还得是方太，又好用又好看，真心推荐！！服务也一级棒，每一个客服又耐心又超nice清洁很好商家回复：我在方太理想城的里边想着你，你在远方的山上春风十里，今天的风吹向你下了雨，我所有的酒都不如你满意的话语！更多,5,2025年8月13,,,,否,我在方太理想城的里边想着你，你在远方的山上春风十里，今天的风吹向你下了雨，我所有的酒都不如你满意的话语！更多
r_1771737727482_453,tmall,,,匿名买家2024年10月21日已购：JPCD12E-NT01S 13套 黑色00买方太，找小兴，服务非常到位！商家回复：在那么多店铺中选择我们，是缘分，也是我们的荣幸。我们将一如既往的为您提供优质的服务，我们完善的售前、售后服务，将全程为您的愉快购物保驾护航，对待每一位客户都是像对待自己家人一样呢。 更多,5,2024年10月21,,,,否,在那么多店铺中选择我们，是缘分，也是我们的荣幸。我们将一如既往的为您提供优质的服务，我们完善的售前、售后服务，将全程为您的愉快购物保驾护航，对待每一位客户都是像对待自己家人一样呢。 更多
r_1771737727482_454,tmall,,,匿名买家2025年2月20日已购：JPCD12E-NT01S 13套 黑色983洗碗机非常好用 解放双手可以去做更多更有意义的事 而且安装师傅也很专业 售后的效率也很高商家回复：(≖ᴗ≖)✧嘻嘻~看到太粉大人用上了我们的洗碗机，方小太的心里可真高兴~太粉大人可以有更多的时间陪伴家人啦~祝您生活愉快，事事顺心~ 更多,5,2025年2月20,,,,否,(≖ᴗ≖)✧嘻嘻~看到太粉大人用上了我们的洗碗机，方小太的心里可真高兴~太粉大人可以有更多的时间陪伴家人啦~祝您生活愉快，事事顺心~ 更多
r_1771737727482_455,tmall,小**,,小**02024年5月13日已购：JPCD12E-NT01S 13套 黑色00该用户觉得商品非常好，给出5星好评商家回复：尊贵的顾客，感谢您在众多选项中选择了我们。我们以恒心和毅力，坚守品质的高地，用最优质的原料和最精湛的工艺，为您打造每一份精致的生活体验。愿我们的服务如同您身边的守护者，永远准备着在您需要时提供帮助与支持。更多,5,2024年5月13,,,,否,尊贵的顾客，感谢您在众多选项中选择了我们。我们以恒心和毅力，坚守品质的高地，用最优质的原料和最精湛的工艺，为您打造每一份精致的生活体验。愿我们的服务如同您身边的守护者，永远准备着在您需要时提供帮助与支持。更多
r_1771737727482_456,tmall,,,匿名买家2024年8月26日已购：JPCD6E-02-B-NF1 13套 白色012声音大小：声音都还好不会太吵能接受的 清洗容量：13套差不多日常使用 其他特色：可以app操作挺方便的 目前用起来还不错  清洁很好商家回复：亲爱的~感谢您对我们的评价，您的夸奖让我们充满力量！我们将以卓越的性价比来回报您的关爱与支持，我们努力提供最好的产品给您，期望赢得您最大的满意和肯定！祝您每天健康幸福！ 更多,5,2024年8月26,,,,否,亲爱的~感谢您对我们的评价，您的夸奖让我们充满力量！我们将以卓越的性价比来回报您的关爱与支持，我们努力提供最好的产品给您，期望赢得您最大的满意和肯定！祝您每天健康幸福！ 更多
r_1771737727482_457,tmall,小**嘿,,小**嘿2025年5月26日已购：JPCD12E-NT01S 13套 黑色3122正在清洗中，碗和杯子洗的干净，特别是杯子，有点发黄的水垢也能洗干净，挺好的😁宝宝的奶瓶还有我家的茶具都放进去洗，让我婆婆省了不少时间精力。 接下来说几个缺点:1、清洗时间比较长，我们每次都用日常洗，日常洗是1小时20分钟的时间，超净洗是2小时。节能洗忘了多久。云清洗是半个小时，但我没用过，不知道云清洗能不能洗干净，如果云清洗能洗干净的话，以后我应该多数会选择云清洗。 2、每次洗完了以后都会自动开启保洁存储，也就是烘干通风那些。因为我家的碗每次洗完都会放到另一个柜子。这个功能又不能设置取消，每次必须洗完碗以后手动长按关闭电源才行，就挺不方便的 其他的优缺点暂时还没有发现，以后用了再追评商家回复：感谢您停留小铺，才会让我们遇见彼此。因为有您，让我们懂得幸福，感谢您这么用心的爱着我们的产品。今后使用中有任何问题都可以联系我们在线客服，您的事就是我们的事，我们会第一时间为您解决的！更多,5,2025年5月26,,商家回复：感谢您停留小铺，才会让我们遇见彼此。因为有您，让我们懂得幸福，感谢您这么用心的爱着我们的产品。今后使用中有任何问题都可以联系我们在线客服，您的事就是我们的事，我们会第一时间为您解决的！更多,,否,感谢您停留小铺，才会让我们遇见彼此。因为有您，让我们懂得幸福，感谢您这么用心的爱着我们的产品。今后使用中有任何问题都可以联系我们在线客服，您的事就是我们的事，我们会第一时间为您解决的！更多
r_1771737727482_458,tmall,,,匿名买家2024年8月30日已购：JPCD12E-NT01S 13套 黑色352洗碗机解放双手，客服很有耐心，如果要改装，一定要和师傅提前沟通好，不然没办法直接橱柜改装，碗筷也得摆好，不然容易有积水，洗完感觉那个洗衣机喷壁还是有水，得开一下通风晾干比较好。商家回复：感谢您的信任与选购！您提出的宝贵建议，方小太已收到哦~我们会再接再厉，为给您带来更好的产品和服务而努力。今后使用中有任何问题都可以联系我们在线客服，您的事就是我们的事，我们会第一时间为您解决的！祝您万事顺意，阖家欢乐~ 更多,5,2024年8月30,,,,否,感谢您的信任与选购！您提出的宝贵建议，方小太已收到哦~我们会再接再厉，为给您带来更好的产品和服务而努力。今后使用中有任何问题都可以联系我们在线客服，您的事就是我们的事，我们会第一时间为您解决的！祝您万事顺意，阖家欢乐~ 更多
r_1771737727482_459,tmall,,,匿名买家2024年12月19日已购：JPCD12E-NT01S 13套 黑色00还不错，2口之家很合适，碗洗的很干净商家回复：(≖ᴗ≖)✧嘻嘻~看到太粉大人用上了我们的洗碗机，方小太的心里可真高兴~太粉大人可以有更多的时间陪伴家人啦~祝您生活愉快，事事顺心~ 更多,5,2024年12月19,,,,否,(≖ᴗ≖)✧嘻嘻~看到太粉大人用上了我们的洗碗机，方小太的心里可真高兴~太粉大人可以有更多的时间陪伴家人啦~祝您生活愉快，事事顺心~ 更多
r_1771737727482_460,tmall,橘**,,橘**y2025年7月5日已购：JPCD6E-02-B-NF1 14套 白色09颜值特别高，非常好看，客服态度也特别好，提前还上门看了适不适合安装，值得推荐，非常棒。商家回复：好缘分不会输给时间，贵在相伴。您的好评是对我们最大的支持与鼓励，也将是我们不断前进的动力！千万个心愿，无数个祝福，愿您每天有个好心情~~更多,5,2025年7月5,,,,否,好缘分不会输给时间，贵在相伴。您的好评是对我们最大的支持与鼓励，也将是我们不断前进的动力！千万个心愿，无数个祝福，愿您每天有个好心情~~更多
r_1771737727482_461,tmall,,,匿名买家2024年12月16日已购：JPCD12E-NT01S 13套 黑色212家里原来的是消毒柜，这次更换的方太洗碗机，本来想购买17套的那款怎奈橱柜位置空间不够只能买下这台，不过也没让我失望，挺好的，客服服务也不错清洁很好商家回复：在那么多店铺中选择我们，是缘分，也是我们的荣幸。我们将一如既往的为您提供优质的服务，我们完善的售前、售后服务，将全程为您的愉快购物保驾护航，对待每一位客户都是像对待自己家人一样呢。 更多,5,2024年12月16,,,,否,在那么多店铺中选择我们，是缘分，也是我们的荣幸。我们将一如既往的为您提供优质的服务，我们完善的售前、售后服务，将全程为您的愉快购物保驾护航，对待每一位客户都是像对待自己家人一样呢。 更多
r_1771737727482_462,tmall,地**使,,地**使2025年6月21日已购：JPCD12E-NT01S 14套 黑色02声音大小：声音不大，就是水流的声音。 清洗容量：清洗容量足够一家四口日常使用。  老房子厨房太小了！终于有合适尺寸的洗碗机能把老消毒碗柜换掉了！清洁效果非常不错！很满意！终于不用再噘这洗碗了！😂😂😂 清洁很好商家回复：亲爱的顾客，感谢您的支持与信赖！正是因为有了您的认可，我们才能不断进步。您的每一次肯定都是对我们最大的鼓励，我们会继续以优质的产品和贴心的服务回馈您的厚爱，期待与您携手共创更多美好购物体验！更多,5,2025年6月21,,,,否,亲爱的顾客，感谢您的支持与信赖！正是因为有了您的认可，我们才能不断进步。您的每一次肯定都是对我们最大的鼓励，我们会继续以优质的产品和贴心的服务回馈您的厚爱，期待与您携手共创更多美好购物体验！更多
r_1771737727482_463,tmall,用**,,用**92025年10月11日已购：JPCD12E-NT01S 14套 黑色00该用户觉得商品非常好，给出5星好评当天追评：不错不错  客服服务很好 也很耐心 安装师傅 技术熟练 人也很好 大品牌 就是好 试一下净音 商家回复：不早不晚的相遇，一切都是最好的安排，极致的服务来源于我们对您的重视，谢谢太粉对咱服务技师的肯定！我们的产品让您动心，我们的服务让您省心，我们的细节让您放心，后续的使用让您舒心，这是我们孜孜不倦的追求！愿您拥一份从容心情，赏一路美好风景！更多,5,2025年10月11,,不错不错  客服服务很好 也很耐心 安装师傅 技术熟练 人也很好 大品牌 就是好 试一下净音 商家回复：不早不晚的相遇，一切都是最好的安排，极致的服务来源于我们对您的重视，谢谢太粉对咱服务技师的肯定！我们的产品让您动心，我们的服务让您省心，我们的细节让您放心，后续的使用让您舒心，这是我们孜孜不倦的追求！愿您拥一份从容心情，赏一路美好风景！更多,,否,不早不晚的相遇，一切都是最好的安排，极致的服务来源于我们对您的重视，谢谢太粉对咱服务技师的肯定！我们的产品让您动心，我们的服务让您省心，我们的细节让您放心，后续的使用让您舒心，这是我们孜孜不倦的追求！愿您拥一份从容心情，赏一路美好风景！更多
r_1771737727482_464,tmall,用**,,用**72025年6月29日已购：JPCD12E-NT01S 14套 黑色01发现人住多了，还是需要有洗碗机，真的是可以解决很多的，所以最后还是选择了要去购买一个洗碗机用起来很方便的商家回复：看到您的好评瞬间充满能量！这份认可比任何奖励都珍贵，我们会带着这份动力，把每一次服务都做到超预期！更多,5,2025年6月29,,,,否,看到您的好评瞬间充满能量！这份认可比任何奖励都珍贵，我们会带着这份动力，把每一次服务都做到超预期！更多
r_1771737727482_465,tmall,王**,,王**12025年6月9日已购：JPCD12E-NT01S 14套 黑色08人多吃饭，解放双手神器，洗完四壁会有残留水珠，洗的可以商家回复：不早不晚的相遇，一切都是最好的安排。您的句句认可和肯定，真实的话语，让我们不由间又多了一份信心，我们会不忘初心，做到更好。希望您永远记得有我们伴在您的身边，我们时刻准备着再次为您服务！更多,5,2025年6月9,,,,否,不早不晚的相遇，一切都是最好的安排。您的句句认可和肯定，真实的话语，让我们不由间又多了一份信心，我们会不忘初心，做到更好。希望您永远记得有我们伴在您的身边，我们时刻准备着再次为您服务！更多
r_1771737727483_466,tmall,垚**,,垚**82024年11月25日已购：JPCD12E-NT01S 13套 黑色03这款洗碗机颜值高，家里空间比较局促，这款嵌入式刚好符合我家要求，很满意，试了一下，洗完效果也很好。商家回复：(≖ᴗ≖)✧嘻嘻~看到太粉大人用上了我们的洗碗机，方小太的心里可真高兴~太粉大人可以有更多的时间陪伴家人啦~祝您生活愉快，事事顺心~ 更多,5,2024年11月25,,,,否,(≖ᴗ≖)✧嘻嘻~看到太粉大人用上了我们的洗碗机，方小太的心里可真高兴~太粉大人可以有更多的时间陪伴家人啦~祝您生活愉快，事事顺心~ 更多
r_1771737727483_467,tmall,,,匿名买家2024年11月7日已购：JPCD12E-NT01S 13套 黑色00清洗容量：可以 声音大小：能接受 其他特色：方便 清洁很好商家回复：倾心相遇，安暖相陪。您的回复是多么的用心啊！让我感觉到认识这么好的买家实在是太晚了！我们对待每一位顾客就像对待亲人一样，为您挑选最适合的宝贝哦，都只为得到您的赞美。~(@^_^@)~更多,5,2024年11月7,,,,否,倾心相遇，安暖相陪。您的回复是多么的用心啊！让我感觉到认识这么好的买家实在是太晚了！我们对待每一位顾客就像对待亲人一样，为您挑选最适合的宝贝哦，都只为得到您的赞美。~(@^_^@)~更多
r_1771737727483_468,tmall,爱**,,爱**72024年8月12日已购：JPCD12E-NT01S 13套 黑色029感谢客服小田很耐心的回答问题，安装师傅也很给力，洗碗机也很漂亮，新家全套都是方太的，还没入住，等以后用了在来追平商家回复：正是拥有一批像您这样的客户，我们才能一步步走到今天。谢谢太粉对咱服务技师的肯定！极致的服务来源于我们对您的重视。我们的产品让您动心，我们的服务让您省心，我们的细节让您放心，后续的使用让您舒心，这是我们孜孜不倦的追求！永远相信美好的事情即将发生~ 更多,5,2024年8月12,,,,否,正是拥有一批像您这样的客户，我们才能一步步走到今天。谢谢太粉对咱服务技师的肯定！极致的服务来源于我们对您的重视。我们的产品让您动心，我们的服务让您省心，我们的细节让您放心，后续的使用让您舒心，这是我们孜孜不倦的追求！永远相信美好的事情即将发生~ 更多
