ID,平台,用户昵称,用户等级,评论内容,评分,日期,SKU,追加评论,追加日期,有图片,商家回复
r_1771737727471_125,tmall,**,,p**i2025年10月26日已购：JPCD12E-NT01S 14套 黑色00很不错，快递也快，结合国补价格很不错，好评商家回复：您的反馈无不是对我们无形的帮助，也是为我们方太的发展注入新的动力。莫大的支持是对我们坚守品牌的最大信心，感谢您的赞美，我们会以更高的服务标准迎接下次相遇～更多,5,2025年10月26,,,,否,您的反馈无不是对我们无形的帮助，也是为我们方太的发展注入新的动力。莫大的支持是对我们坚守品牌的最大信心，感谢您的赞美，我们会以更高的服务标准迎接下次相遇～更多
r_1771737727471_126,tmall,谁**光,,谁**光2025年12月10日已购：JPCD12E-NT01S 14套 黑色00完好无损商家回复：确认过眼神，你是对的人。相信我们的产品不会让您失望的，后期需要安装了可以拨打我司热线952315预约，未来是让人想象不到的，所以才有所期待，我一直在期待着你使用满意~~更多,5,2025年12月10,,,,否,确认过眼神，你是对的人。相信我们的产品不会让您失望的，后期需要安装了可以拨打我司热线952315预约，未来是让人想象不到的，所以才有所期待，我一直在期待着你使用满意~~更多
r_1771737727471_127,tmall,,,匿名买家2025年10月29日已购：JPCD12E-NT01S 14套 黑色09外观简洁大方有质感，清洗容量足够，客服安然态度很好有耐心  清洁很好商家回复：亲爱的顾客，看到您那么满意，我们也是万分开心呐，您对我们的满意就是对我们最大的支持，我们会越做越好，争取让越来越多的人满意，感谢您的大力支持！愿您宝贝用的好，永远没烦恼。更多,5,2025年10月29,,,,否,亲爱的顾客，看到您那么满意，我们也是万分开心呐，您对我们的满意就是对我们最大的支持，我们会越做越好，争取让越来越多的人满意，感谢您的大力支持！愿您宝贝用的好，永远没烦恼。更多
r_1771737727471_128,tmall,就**样,,就**样2025年10月21日已购：JPCD12E-NT01S 14套 黑色00改装后也很好看哦，14套容量一点也不小哦，也可以适用多孩家庭呢商家回复：感恩您选择这款洗碗机！这份认可太让我们开心～愿它常为您的厨房添份便捷与颜值。更多,5,2025年10月21,,,,否,感恩您选择这款洗碗机！这份认可太让我们开心～愿它常为您的厨房添份便捷与颜值。更多
r_1771737727471_129,tmall,**,,x**n2025年10月21日已购：JPCD12E-NT01S 14套 黑色156旧房加装，位子比较小，买这款替代原来的消毒柜刚好。师傅先来看了位置确定能装，再发货，免费厨改，坐等效果清洁很好商家回复：确认过眼神，你是对的人。相信我们的产品不会让您失望的，后期需要安装了可以拨打我司热线952315预约，24小时热线竭诚为您服务！未来是让人想象不到的，所以才有所期待，我一直在期待着您使用满意~~更多,5,2025年10月21,,,,否,确认过眼神，你是对的人。相信我们的产品不会让您失望的，后期需要安装了可以拨打我司热线952315预约，24小时热线竭诚为您服务！未来是让人想象不到的，所以才有所期待，我一直在期待着您使用满意~~更多
r_1771737727471_130,tmall,**,,c**c2025年10月24日已购：JPCD12E-NT01S 14套 黑色00洗碗机颜值很高 安装师傅很负责任 很喜欢清洁很好商家回复：一个暖心的好评，给予我们一天愉快的心情。有人惦记，再远的路，也是近的。有人挂念，再淡的水，也是甜的。有人支持，再冷的天，心也是暖的。感恩遇见！我们将更加热情，更加努力，更加专业的为您服务哦！更多,5,2025年10月24,,,,否,一个暖心的好评，给予我们一天愉快的心情。有人惦记，再远的路，也是近的。有人挂念，再淡的水，也是甜的。有人支持，再冷的天，心也是暖的。感恩遇见！我们将更加热情，更加努力，更加专业的为您服务哦！更多
r_1771737727471_131,tmall,**,,D**s2025年10月24日已购：JPCD6E-02-B-NF1 14套 白色036方太洗碗机大牌值得购入，品质有保证，质量很好，服务不错，选择方太洗碗机放心省心，商家回复：借时光之手，暖一束花开，于凉薄之冬，让春意暖暖。我们一直在坚持好的品质和好的服务，为的就是让我们的宝贝遇到对的人。携手方小太，让您笑口常开，天天八颗牙齿晒太阳~~更多,5,2025年10月24,,,,否,借时光之手，暖一束花开，于凉薄之冬，让春意暖暖。我们一直在坚持好的品质和好的服务，为的就是让我们的宝贝遇到对的人。携手方小太，让您笑口常开，天天八颗牙齿晒太阳~~更多
r_1771737727471_132,tmall,假**子,,假**子2025年12月21日已购：JPCD12E-NT01S 14套 黑色00很好用，洗涤干净，师傅提前上门测量，给的方案很中肯，凑上活动，性价比超高。商家回复：哇塞(*^▽^*)~非常荣幸我们方太的产品能得到您的认可~你的赞美，我们视为珍宝，逐字逐句记在心里。我们会继续保持，不断变得更棒的!更多,5,2025年12月21,,,,否,哇塞(*^▽^*)~非常荣幸我们方太的产品能得到您的认可~你的赞美，我们视为珍宝，逐字逐句记在心里。我们会继续保持，不断变得更棒的!更多
r_1771737727471_133,tmall,用**,,用**42025年11月1日已购：JPCD12E-NT01S 14套 黑色115安装师傅超级棒，尽职尽责，客服也是从咨询到售后一直很热情。已经安装完啦，期待使用效果了！商家回复：尊敬的太粉！您的认可让我们更坚定了用心服务的信念～ 方太将一如既往提供专业贴心的服务，从售前产品讲解到售后使用跟进，每一环都倾注真心，像对待家人般呵护您的选择，祝愿您每天都收获满满幸福！更多,5,2025年11月1,,,,否,尊敬的太粉！您的认可让我们更坚定了用心服务的信念～ 方太将一如既往提供专业贴心的服务，从售前产品讲解到售后使用跟进，每一环都倾注真心，像对待家人般呵护您的选择，祝愿您每天都收获满满幸福！更多
r_1771737727471_134,tmall,肥**,,肥**32025年11月26日已购：JPCD12E-NT01S 14套 黑色00双十一下单的到现在，天天用，洗得挺干净的商家回复：日子，过的是心情；生活，要的是质量世间予我千万种满心欢喜，沿途逐枝怒放，全部遗漏都不要紧，只要你满意就好，愿我们的产品可以陪着亲爱的度过美好的岁月。更多,5,2025年11月26,,,,否,日子，过的是心情；生活，要的是质量世间予我千万种满心欢喜，沿途逐枝怒放，全部遗漏都不要紧，只要你满意就好，愿我们的产品可以陪着亲爱的度过美好的岁月。更多
r_1771737727471_135,tmall,,,匿名买家2025年10月27日已购：JPCD12E-NT01S 14套 黑色242洗碗机很好，安装好后也很好看，以后解放双手了，安装师傅也非常专业，且细心负责，商家回复：从最初，到现在，到未来，我们一步一脚印走到现在，特别珍惜每一位太粉对我们的支持，所以我们最大的旨意就是将优质的产品和贴心的服务带到您身边，以回馈您对我们的厚爱！感谢您对我们的支持与信赖，期待与您的再一次相遇～更多,5,2025年10月27,,,,否,从最初，到现在，到未来，我们一步一脚印走到现在，特别珍惜每一位太粉对我们的支持，所以我们最大的旨意就是将优质的产品和贴心的服务带到您身边，以回馈您对我们的厚爱！感谢您对我们的支持与信赖，期待与您的再一次相遇～更多
r_1771737727471_136,tmall,圆**油,,圆**油2025年10月10日已购：JPCD12E-NT01S 14套 黑色18799非常好，当天买隔天差不多就到啦，速度非常快，买之前就有师傅来看，方太工作很认真负责，安装的很仔细，期待使用！！！！安装完结束，工作人员简单地教了一下怎么使用。清洁很好商家回复：感谢太粉对我们的认可~好的产品，好的服务是赢得客户尊敬的基础，但我们不会仅仅满足于此。感谢您对我们师傅的肯定，相信师傅也会不断的提高技能，为您带去更优质的服务。更多,5,2025年10月10,,,,否,感谢太粉对我们的认可~好的产品，好的服务是赢得客户尊敬的基础，但我们不会仅仅满足于此。感谢您对我们师傅的肯定，相信师傅也会不断的提高技能，为您带去更优质的服务。更多
r_1771737727471_137,tmall,,,匿名买家2025年10月26日已购：JPCD6E-02-B-NF1 14套 白色00尺寸友好，适合我这种旧柜子改造的用户，师傅上门安装也及时，橱柜拆改和水路改造都没收费，好评 APP可以选择更多档位，洗碗很干净商家回复：简单的话语，入心的是欣喜，是吉言，是执着难免。我们定会在好评的道路上勇往直前。方太定会为您们准备更好的宝贝和更好的服务，欢迎再次光临哦~更多,5,2025年10月26,,,,否,简单的话语，入心的是欣喜，是吉言，是执着难免。我们定会在好评的道路上勇往直前。方太定会为您们准备更好的宝贝和更好的服务，欢迎再次光临哦~更多
r_1771737727471_138,tmall,可**欣,,可**欣2025年10月18日已购：JPCD12E-NT01S 14套 黑色00一直都是用方太的产品。改装的师傅很专业，期待使用的效果商家回复：特别感谢您一直选择方太产品！也开心改装师傅的专业能让您满意，我们和您一样期待后续的使用效果～后续若有任何需求，随时联系我们就好。更多,5,2025年10月18,,,,否,特别感谢您一直选择方太产品！也开心改装师傅的专业能让您满意，我们和您一样期待后续的使用效果～后续若有任何需求，随时联系我们就好。更多
r_1771737727471_139,tmall,*,,匿名买家2025年11月9日已购：JPCD12E-NT01S 14套 黑色00该用户未填写评价内容27天后追评：家中人还用不习惯，还要慢慢学会享受高科技产品。产品颜值高，服务好！商家回复：哇塞(*^▽^*)~非常荣幸我们方太的产品能得到您的认可~你的赞美，我们视为珍宝，逐字逐句记在心里。我们会继续保持，不断变得更棒的!更多,5,2025年11月9,,家中人还用不习惯，还要慢慢学会享受高科技产品。产品颜值高，服务好！商家回复：哇塞(*^▽^*)~非常荣幸我们方太的产品能得到您的认可~你的赞美，我们视为珍宝，逐字逐句记在心里。我们会继续保持，不断变得更棒的!更多,,否,哇塞(*^▽^*)~非常荣幸我们方太的产品能得到您的认可~你的赞美，我们视为珍宝，逐字逐句记在心里。我们会继续保持，不断变得更棒的!更多
r_1771737727471_140,tmall,**,,f**o2025年11月8日已购：JPCD12E-NT01S 14套 黑色00很满意，超赞商家回复：亲爱的顾客~感谢您选择我们方太的产品~相信我们的产品和服务是不会让您失望的呢~更多,5,2025年11月8,,,,否,亲爱的顾客~感谢您选择我们方太的产品~相信我们的产品和服务是不会让您失望的呢~更多
r_1771737727471_141,tmall,思**,,思**52025年10月17日已购：JPCD12E-NT01S 14套 黑色00从没想过这么实惠的价格能买到这么好的宝贝，下次还来你家商家回复：您的反馈无不是对我们无形的帮助，也是为我们方太的发展注入新的动力。莫大的支持是对我们坚守品牌的最大信心，感谢您的赞美，我们会以更高的服务标准迎接下次相遇～更多,5,2025年10月17,,,,否,您的反馈无不是对我们无形的帮助，也是为我们方太的发展注入新的动力。莫大的支持是对我们坚守品牌的最大信心，感谢您的赞美，我们会以更高的服务标准迎接下次相遇～更多
r_1771737727471_142,tmall,**,,j**x2025年11月30日已购：JPCD6E-02-B-NF1 14套 白色00该用户觉得商品非常好，给出5星好评1天后追评：800碗篮改装的，师傅服务非常好 商家回复：感谢太粉对我们的认可~好的产品，好的服务是赢得客户尊敬的基础，但我们不会仅仅满足于此。感谢您对我们师傅的肯定，相信师傅也会不断的提高技能，为您带去更优质的服务。更多,5,2025年11月30,,800碗篮改装的，师傅服务非常好 商家回复：感谢太粉对我们的认可~好的产品，好的服务是赢得客户尊敬的基础，但我们不会仅仅满足于此。感谢您对我们师傅的肯定，相信师傅也会不断的提高技能，为您带去更优质的服务。更多,,否,感谢太粉对我们的认可~好的产品，好的服务是赢得客户尊敬的基础，但我们不会仅仅满足于此。感谢您对我们师傅的肯定，相信师傅也会不断的提高技能，为您带去更优质的服务。更多
r_1771737727471_143,tmall,**,,h**j2025年11月20日已购：JPCD12E-NT01S 14套 黑色00产品非常不错，值得购买，解放双手商家回复：太粉大人，您的满意是我们最大的追求。如有任何问题或建议，欢迎联系我们。祝您生活愉快！更多,5,2025年11月20,,,,否,太粉大人，您的满意是我们最大的追求。如有任何问题或建议，欢迎联系我们。祝您生活愉快！更多
r_1771737727471_144,tmall,我**,,我**！2025年11月29日已购：JPCD12E-NT01S 14套 黑色00该用户未填写评价内容72天后追评：洗碗机很好用 颜值很高商家回复：得此美言甚是欢喜，如沐春风在心间！因为有您，让我们懂得幸福，感谢您这么用心的爱着我们的产品。后期如果有任何问题都可以联系咱家客服或者拨打服务电话：952315。更多,5,2025年11月29,,洗碗机很好用 颜值很高商家回复：得此美言甚是欢喜，如沐春风在心间！因为有您，让我们懂得幸福，感谢您这么用心的爱着我们的产品。后期如果有任何问题都可以联系咱家客服或者拨打服务电话：952315。更多,,否,得此美言甚是欢喜，如沐春风在心间！因为有您，让我们懂得幸福，感谢您这么用心的爱着我们的产品。后期如果有任何问题都可以联系咱家客服或者拨打服务电话：952315。更多
r_1771737727471_145,tmall,不**虎,,不**虎2025年12月11日已购：JPCD12E-NT01S 14套 黑色01不错，是我喜欢的样子，款式也好看尺寸也合适，客服念念也超好一步步耐心解答，不错商家回复：亲爱的顾客，感谢你选择方太并给予好评！你的认可就是我们前进的动力，从产品到服务，我们始终用心打磨每一处细节。后续使用中有任何需求，随时联系我们，祝你使用愉快，期待再次相遇～更多,5,2025年12月11,,,,否,亲爱的顾客，感谢你选择方太并给予好评！你的认可就是我们前进的动力，从产品到服务，我们始终用心打磨每一处细节。后续使用中有任何需求，随时联系我们，祝你使用愉快，期待再次相遇～更多
r_1771737727472_147,tmall,飞**象,,飞**象2025年10月18日已购：JPCD12E-NT01S 14套 黑色00品牌还是品牌，销售售后一条龙服务，14套其实4五口家庭也挺好用的了。商家回复：简单的话语，入心的是欣喜，是吉言，是执着难免。我们定会在好评的道路上勇往直前。方太定会为您们准备更好的宝贝和更好的服务，欢迎再次光临哦~更多,5,2025年10月18,,,,否,简单的话语，入心的是欣喜，是吉言，是执着难免。我们定会在好评的道路上勇往直前。方太定会为您们准备更好的宝贝和更好的服务，欢迎再次光临哦~更多
r_1771737727472_149,tmall,用**,,用**12025年12月8日已购：JPCD12E-NT01S 14套 黑色00囤货中还没用拆商家回复：确认过眼神，你是对的人。相信我们的产品不会让您失望的，后期需要安装了可以拨打我司热线952315预约，未来是让人想象不到的，所以才有所期待，我一直在期待着你使用满意~~更多,5,2025年12月8,,,,否,确认过眼神，你是对的人。相信我们的产品不会让您失望的，后期需要安装了可以拨打我司热线952315预约，未来是让人想象不到的，所以才有所期待，我一直在期待着你使用满意~~更多
r_1771737727472_150,tmall,木**涵,,木**涵2025年12月8日已购：JPCD6E-02-B-NF1 14套 白色02洗碗机很漂亮，师傅在发货前上门看了预留位置，后期安装很快，没有多余的安装费用👍商家回复：太粉大人，感谢您在万千选择中坚定的选择我们~相信我们的产品不会让您失望~方小太的产品颜值和实力并存，很不错的呢~更多,5,2025年12月8,,,,否,太粉大人，感谢您在万千选择中坚定的选择我们~相信我们的产品不会让您失望~方小太的产品颜值和实力并存，很不错的呢~更多
r_1771737727472_151,tmall,**,,t**z2025年11月3日已购：JPCD12E-NT01S 14套 黑色00已经是第二台了，一如既往喜欢这个型号商家回复：感谢您对我们方太的长期的关注与支持！每一个点击，每一次对话，每一秒等待，都会拉近我们的距离。有您的支持，我们的团队会变得更加充实而快乐ヾ(●´∀｀●)。更多,5,2025年11月3,,,,否,感谢您对我们方太的长期的关注与支持！每一个点击，每一次对话，每一秒等待，都会拉近我们的距离。有您的支持，我们的团队会变得更加充实而快乐ヾ(●´∀｀●)。更多
r_1771737727472_152,tmall,**儿,,2**儿2025年11月2日已购：JPCD12E-NT01S 14套 黑色00还没用，应该不错，安装服务不错商家回复：太欣慰收到您的反馈！虽然还未使用，但您对安装服务的肯定和对产品的期待，都是我们的动力，感恩信任～更多,5,2025年11月2,,,,否,太欣慰收到您的反馈！虽然还未使用，但您对安装服务的肯定和对产品的期待，都是我们的动力，感恩信任～更多
r_1771737727472_153,tmall,茶**青,,茶**青2025年11月2日已购：JPCD12E-NT01S 14套 黑色01服务很好商家回复：太粉的每一份信任，都是我们最珍视的礼物～ 您的好评让服务团队干劲满满！方太会一如既往提供优质服务，售前耐心指引、售后及时响应，像家人一样呵护您的每一次选择，愿您天天开心！更多,5,2025年11月2,,,,否,太粉的每一份信任，都是我们最珍视的礼物～ 您的好评让服务团队干劲满满！方太会一如既往提供优质服务，售前耐心指引、售后及时响应，像家人一样呵护您的每一次选择，愿您天天开心！更多
r_1771737727472_154,tmall,**,,b**e2025年11月8日已购：JPCD6E-02-B-NF1 14套 白色02很好，大小合适。跟我家颜色挺配的。快递小哥很好，顺手帮我拿了其他快递。感恩！商家回复：这个世界，拥有爱的方法是以真心换真心。言语中的喜欢和满意，细腻的话语已经暖化了我们的心，我们感到很荣幸也很幸福。为您提供更加优质的产品和周到的服务，一如既往，从未放弃。更多,5,2025年11月8,,,,否,这个世界，拥有爱的方法是以真心换真心。言语中的喜欢和满意，细腻的话语已经暖化了我们的心，我们感到很荣幸也很幸福。为您提供更加优质的产品和周到的服务，一如既往，从未放弃。更多
r_1771737727472_156,tmall,想**,,想**！2025年11月1日已购：JPCD12E-NT01S 14套 黑色00到货非常快，安装也很快，而且安装师傅非常专业，都看不出改装的痕迹，非常好，洗的也很感觉商家回复：能让您在安装环节感受到放心，是我们和师傅共同的目标！您的好评不仅是对师傅的认可，也是对我们服务标准的肯定。后续使用产品时，若遇到什么需要协助的地方，联系我们，我们会像师傅一样，用细致的态度守护您的体验～更多,5,2025年11月1,,,,否,能让您在安装环节感受到放心，是我们和师傅共同的目标！您的好评不仅是对师傅的认可，也是对我们服务标准的肯定。后续使用产品时，若遇到什么需要协助的地方，联系我们，我们会像师傅一样，用细致的态度守护您的体验～更多
r_1771737727472_157,tmall,,,匿名买家2025年10月25日已购：JPCD12E-NT01S 14套 黑色144师傅安装认真负责，讲解也仔细，洗碗机内部空间比较大，噪音小，美观好看。商家回复：您的反馈无不是对我们无形的帮助，也是为我们方太的发展注入新的动力。莫大的支持是对我们坚守品牌的最大信心，感谢您的赞美，我们会以更高的服务标准迎接下次相遇～更多,5,2025年10月25,,,,否,您的反馈无不是对我们无形的帮助，也是为我们方太的发展注入新的动力。莫大的支持是对我们坚守品牌的最大信心，感谢您的赞美，我们会以更高的服务标准迎接下次相遇～更多
r_1771737727472_158,tmall,和**戏,,和**戏2025年11月4日已购：JPCD12E-NT01S 14套 黑色00该用户未填写评价内容25天后追评：已经安装了，价格很合适，可以释放双手了商家回复：太粉大人，您的满意是我们最大的追求。如有任何问题或建议，欢迎随时联系我们。祝您生活愉快！更多,5,2025年11月4,,已经安装了，价格很合适，可以释放双手了商家回复：太粉大人，您的满意是我们最大的追求。如有任何问题或建议，欢迎随时联系我们。祝您生活愉快！更多,,否,太粉大人，您的满意是我们最大的追求。如有任何问题或建议，欢迎随时联系我们。祝您生活愉快！更多
r_1771737727472_159,tmall,蓝**云,,蓝**云2025年10月19日已购：JPCD12E-NT01S 14套 黑色04师傅服务态度很好，安装速度快，美观大气商家回复：看到您夸师傅服务好、安装快，还觉得产品好看，我们瞬间超有成就感！不知道您开始使用后，有没有觉得产品的实用功能也很贴合需求呀？后续有任何疑问，随时找我们就好～更多,5,2025年10月19,,,,否,看到您夸师傅服务好、安装快，还觉得产品好看，我们瞬间超有成就感！不知道您开始使用后，有没有觉得产品的实用功能也很贴合需求呀？后续有任何疑问，随时找我们就好～更多
r_1771737727472_160,tmall,倦**开,,倦**开2025年10月26日已购：JPCD12E-NT01S 14套 黑色00师傅安装负责商家回复：从最初，到现在，到未来，我们一步一脚印走到现在，特别珍惜每一位太粉对我们的支持，所以我们最大的旨意就是将优质的产品和贴心的服务带到您身边，以回馈您对我们的厚爱！感谢您对我们的支持与信赖，期待与您的再一次相遇～更多,5,2025年10月26,,,,否,从最初，到现在，到未来，我们一步一脚印走到现在，特别珍惜每一位太粉对我们的支持，所以我们最大的旨意就是将优质的产品和贴心的服务带到您身边，以回馈您对我们的厚爱！感谢您对我们的支持与信赖，期待与您的再一次相遇～更多
r_1771737727472_161,tmall,全**糊,,全**糊2025年11月15日已购：JPCD6E-02-B-NF1 14套 白色00洗得特别干净商家回复：太粉的信任从不敢辜负！我们会不断优化产品体验、完善售后流程，让每一次咨询、每一次使用都能让您省心。感恩相遇，愿您用得全程顺心～更多,5,2025年11月15,,,,否,太粉的信任从不敢辜负！我们会不断优化产品体验、完善售后流程，让每一次咨询、每一次使用都能让您省心。感恩相遇，愿您用得全程顺心～更多
r_1771737727472_162,tmall,谁**呱,,谁**呱2025年10月20日已购：JPCD12E-NT01S 14套 黑色00洗碗机装好了，小厨房终于完整啦！解放双手的不二之选，期待入住新家商家回复：太懂这种 “终于完整” 的快乐了！小厨房配上解放双手的洗碗机，入住幸福感直接拉满～超期待你在新家开启轻松做饭的日子！更多,5,2025年10月20,,,,否,太懂这种 “终于完整” 的快乐了！小厨房配上解放双手的洗碗机，入住幸福感直接拉满～超期待你在新家开启轻松做饭的日子！更多
r_1771737727472_163,tmall,**,,t**n2025年10月8日已购：JPCD6E-02-B-NF1 14套 白色375使用体验感还是很不错的，很早就想买一款洗碗机，一直以为只有新房在预留了洗碗机位置的情况下才能装嵌入式洗碗机，没想到方太有免费改装服务，而且效率很高，一天之内就搞完了上门免费测量——南昌仓库发货——免费改装！现在买电器很多都有国䃼，这款洗碗机国补了1700元呢，过年之前都有免费改装，是个不错的购买时间！商家回复：喜欢就好，遇到合适的品牌，选到喜欢的产品，确实是令人开心的事。 您把信任交予给我们的时候，我们相信您买到的不只是一件商品，更多的是一份保障，一份品位。 期待与您再次相遇！更多,5,2025年10月8,,,,否,喜欢就好，遇到合适的品牌，选到喜欢的产品，确实是令人开心的事。 您把信任交予给我们的时候，我们相信您买到的不只是一件商品，更多的是一份保障，一份品位。 期待与您再次相遇！更多
