ID,平台,用户昵称,用户等级,评论内容,评分,日期,SKU,追加评论,追加日期,有图片,商家回复
r_1771737727465_0,tmall,,,是个阿姨2026-01-01已购：JPCD6E-02-B-NF1 14套 白色家电选的都是方太的，服务没得说，热水器，洗碗机，直饮水，油烟机，灶台。老品牌有保障，本来想买保险的，同事说自己家的家电10几年了都没坏过，所以就没买。客服也是对接的很好，新家全部都是新的。,5,2026-01-01,,,,否,
r_1771737727466_1,tmall,,,思韩flying2026-02-09已购：JPCD12E-NT01S 14套 黑色洗完亮晶晶的很喜欢，师傅上门0元厨改，很方便,5,2026-02-09,,,,否,
r_1771737727466_2,tmall,思**,,思**g2026年2月9日已购：JPCD12E-NT01S 14套 黑色01洗完亮晶晶的很喜欢，师傅上门0元厨改，很方便商家回复：天将降大任于方太也，必先提高品质，去其粗糙，精其细节，才敢打包送到您手中呐～更多,5,2026年2月9,,,,否,天将降大任于方太也，必先提高品质，去其粗糙，精其细节，才敢打包送到您手中呐～更多
r_1771737727466_3,tmall,是**姨,,是**姨2026年1月1日已购：JPCD6E-02-B-NF1 14套 白色339家电选的都是方太的，服务没得说，热水器，洗碗机，直饮水，油烟机，灶台。老品牌有保障，本来想买保险的，同事说自己家的家电10几年了都没坏过，所以就没买。客服也是对接的很好，新家全部都是新的。 商家回复：亲爱的顾客，感谢您对产品的认可！方太始终把品质放在首位，从研发到生产都经过严格把控，能让您感受到产品好，是我们最大的心愿～ 后续使用中有任何疑问，随时联系我们，我们会全程为您保驾护航，期待您再次光临呀！更多24天后追评：轻易不评价，热水器，净水器，洗碗机，油烟机都是买了方太的，售后很快。不需要多费事商家回复：读着您的这份好评，仿佛都能看到您满意的笑容😊，这可是我们工作里最珍贵的小确幸呢！方太始终相信，好服务从来不是空谈，而是咨询时的及时回应、售后时的快速跟进💪。由衷感谢您的认可，我们会带着这份心意，继续为您的每一次购物体验保驾护航～更多,5,2026年1月1,,轻易不评价，热水器，净水器，洗碗机，油烟机都是买了方太的，售后很快。不需要多费事商家回复：读着您的这份好评，仿佛都能看到您满意的笑容😊，这可是我们工作里最珍贵的小确幸呢！方太始终相信，好服务从来不是空谈，而是咨询时的及时回应、售后时的快速跟进💪。由衷感谢您的认可，我们会带着这份心意，继续为您的每一次购物体验保驾护航～更多,,否,亲爱的顾客，感谢您对产品的认可！方太始终把品质放在首位，从研发到生产都经过严格把控，能让您感受到产品好，是我们最大的心愿～ 后续使用中有任何疑问，随时联系我们，我们会全程为您保驾护航，期待您再次光临呀！更多24天后追评：轻易不评价，热水器，净水器，洗碗机，油烟机都是买了方太的，售后很快。不需要多费事商家回复：读着您的这份好评，仿佛都能看到您满意的笑容😊，这可是我们工作里最珍贵的小确幸呢！方太始终相信，好服务从来不是空谈，而是咨询时的及时回应、售后时的快速跟进💪。由衷感谢您的认可，我们会带着这份心意，继续为您的每一次购物体验保驾护航～更多
r_1771737727466_4,tmall,,,匿名买家2026年1月31日已购：JPCD6E-02-B-NF1 14套 白色00该用户未填写评价内容20天后追评：非常不错哦，大气美观，颜值这一块确实没得说！商家回复：这是一段美好的旅程的圆满句点，我们期待着与您的再次相逢，愿您心情愉悦，感谢太粉的好评~~我们相信我们的产品定会赢得您的心，如果未来有任何疑问或需要帮助，欢迎随时联系我们的客服。同时，我们也盼望着您能分享您厨房的美妙瞬间，让我们一同欣赏。(●'◡'●)更多,5,2026年1月31,,非常不错哦，大气美观，颜值这一块确实没得说！商家回复：这是一段美好的旅程的圆满句点，我们期待着与您的再次相逢，愿您心情愉悦，感谢太粉的好评~~我们相信我们的产品定会赢得您的心，如果未来有任何疑问或需要帮助，欢迎随时联系我们的客服。同时，我们也盼望着您能分享您厨房的美妙瞬间，让我们一同欣赏。(●'◡'●)更多,,否,这是一段美好的旅程的圆满句点，我们期待着与您的再次相逢，愿您心情愉悦，感谢太粉的好评~~我们相信我们的产品定会赢得您的心，如果未来有任何疑问或需要帮助，欢迎随时联系我们的客服。同时，我们也盼望着您能分享您厨房的美妙瞬间，让我们一同欣赏。(●'◡'●)更多
r_1771737727466_5,tmall,**,,P**h2025年12月22日已购：JPCD12E-NT01S 14套 黑色140购买体验非常好，因为本身家里之前消毒柜，原位置更换洗碗机担心空间不合适无法安装，同客服沟通后预约上门测量，客户体验非常好。 物流到货很快，提前预约送货上门。 安装很快捷，大概40分钟就安装好了，对上门安装的郭师傅提出表扬。  声音大小：小 清洗容量：中商家回复：感谢太粉对我们的认可~好的产品，好的服务是赢得客户尊敬的基础，但我们不会仅仅满足于此。感谢您对我们师傅的肯定，相信师傅也会不断的提高技能，为您带去更优质的服务。更多,5,2025年12月22,,,,否,感谢太粉对我们的认可~好的产品，好的服务是赢得客户尊敬的基础，但我们不会仅仅满足于此。感谢您对我们师傅的肯定，相信师傅也会不断的提高技能，为您带去更优质的服务。更多
r_1771737727466_6,tmall,奥**屋,,奥**屋2026年1月30日已购：JPCD12E-NT01S 14套 黑色02迫不及待来给个好评，今天刚刚装好，几乎没有声音，碗洗的很干净没有什么水渍，洗碗就消毒拿出来热热的，让人很安心。以后真的可以省下很多洗碗的时间，太开心了，没有白费我挑这么久最终选择了方太 商家回复：非常感谢太粉大人的肯定和支持！我们坚持精益求精的匠心精神，对产品的研发和制造进行严格把控，致力于提供高品质的产品和服务。更多,5,2026年1月30,,,,否,非常感谢太粉大人的肯定和支持！我们坚持精益求精的匠心精神，对产品的研发和制造进行严格把控，致力于提供高品质的产品和服务。更多
r_1771737727466_7,tmall,,,匿名买家2025年12月22日已购：JPCD12E-NT01S 14套 黑色09洗碗机颜值不错，昨晚试用了一下，运行时的声音大小和滚筒洗衣机差不多，可以接受，整体不错商家回复：哇塞(✧◡✧)~能够得到您的赞赏，咱们上班心里都甜滋滋的。每一个评价都是最真实的体验，因为有您，让我们懂得幸福，感谢您这么用心的爱着我们的产品。感谢您对本店的支持与信任，我们会继续努力的哦。更多,5,2025年12月22,,,,否,哇塞(✧◡✧)~能够得到您的赞赏，咱们上班心里都甜滋滋的。每一个评价都是最真实的体验，因为有您，让我们懂得幸福，感谢您这么用心的爱着我们的产品。感谢您对本店的支持与信任，我们会继续努力的哦。更多
r_1771737727466_8,tmall,**,,Z**i2025年12月18日已购：JPCD12E-NT01S 14套 黑色03挺好用的 洗的很干净 师傅先上门量尺寸再下单安装的商家回复：亲爱的，方太的产品值得您的选择和信赖❤我们伴在您的身边，我们时刻准备着再次为您服务！更多,5,2025年12月18,,,,否,亲爱的，方太的产品值得您的选择和信赖❤我们伴在您的身边，我们时刻准备着再次为您服务！更多
r_1771737727467_9,tmall,秋**长,,秋**长2025年12月23日已购：JPCD12E-NT01S 14套 黑色00安装好了，客服和安装人员态度好，我很喜欢，下次还会 选择方太商家回复：希望您在这个充满阳光的世界里有个阳光般的好心情~我们一定会继续努力，尽善尽美，用最真挚的服务对待每一位客户。更多,5,2025年12月23,,,,否,希望您在这个充满阳光的世界里有个阳光般的好心情~我们一定会继续努力，尽善尽美，用最真挚的服务对待每一位客户。更多
r_1771737727467_10,tmall,江**,,江**！2025年12月16日已购：JPCD6E-02-B-NF1 14套 白色00该用户未填写评价内容70天后追评：颜值非常高，白色和橱柜很搭，一眼爱上，安装在水槽下节省空间，使用方便商家回复：当年秦始皇派人远炼制了征两颗长生不老仙丹。其中一颗秦始皇自己服用了，另外一颗让我服，我都不服，就服您的眼光更多,5,2025年12月16,,颜值非常高，白色和橱柜很搭，一眼爱上，安装在水槽下节省空间，使用方便商家回复：当年秦始皇派人远炼制了征两颗长生不老仙丹。其中一颗秦始皇自己服用了，另外一颗让我服，我都不服，就服您的眼光更多,,否,当年秦始皇派人远炼制了征两颗长生不老仙丹。其中一颗秦始皇自己服用了，另外一颗让我服，我都不服，就服您的眼光更多
r_1771737727467_12,tmall,**,,T**02025年12月30日已购：JPCD6E-02-B-NF1 14套 白色044方太的服务太赞了！本来想买水槽款，家里水槽尺寸不够，客服三叶超有耐心，安排测量师傅两次上门测量尺寸，帮我从水槽款换成嵌入式款，安装师傅也特别专业，服务很好，今天第一次用，洗的也很干净，碗碟都烘干了，机器内壁会有水蒸气，需要留个口通风，目前还是挺满意的商家回复：亲爱的太粉~~看到你的评价，方小太开心得都要跳起来了☆⌒(＞。≪)期待您的再次评价！我们承诺会以更好更快的服务，回馈我们的顾客，也期待着您将来为我们的发展提供宝贵的意见，谢谢您的支持呢！更多,5,2025年12月30,,,,否,亲爱的太粉~~看到你的评价，方小太开心得都要跳起来了☆⌒(＞。≪)期待您的再次评价！我们承诺会以更好更快的服务，回馈我们的顾客，也期待着您将来为我们的发展提供宝贵的意见，谢谢您的支持呢！更多
r_1771737727467_13,tmall,可**妈,,可**妈2025年12月15日已购：JPCD6E-02-B-NF1 14套 白色02新家安装选择了大品牌 目前还没使用 登入之后再来追评 不过还是很好看的商家回复：感谢太粉的选择~当您把信任交予给我们的时候，我们相信您买到的不只是一件商品，更多的是一份保障，一份品位。后续有任何问题都可以随时联系我们哦~更多,5,2025年12月15,,不过还是很好看的商家回复：感谢太粉的选择~当您把信任交予给我们的时候，我们相信您买到的不只是一件商品，更多的是一份保障，一份品位。后续有任何问题都可以随时联系我们哦~更多,,否,感谢太粉的选择~当您把信任交予给我们的时候，我们相信您买到的不只是一件商品，更多的是一份保障，一份品位。后续有任何问题都可以随时联系我们哦~更多
r_1771737727467_14,tmall,,,匿名买家2025年12月24日已购：JPCD12E-NT01S 14套 黑色02顺利安装，机器很好看，师傅人也很好。商家回复：太粉大人，感谢您在万千选择中坚定的选择我们~相信我们的产品不会让您失望~方小太的产品颜值和实力并存，很不错的呢~更多,5,2025年12月24,,,,否,太粉大人，感谢您在万千选择中坚定的选择我们~相信我们的产品不会让您失望~方小太的产品颜值和实力并存，很不错的呢~更多
r_1771737727467_15,tmall,是**心,,是**心2026年1月11日已购：JPCD12E-NT01S 14套 黑色00声音大小：声音不大  清洗容量：可以 其他特色：师傅安装的也比较快，改造的很好商家回复：感谢太粉对我们的认可~好的产品，好的服务是赢得客户尊敬的基础，但我们不会仅仅满足于此。感谢您对我们师傅的肯定，相信师傅也会不断的提高技能，为您带去更优质的服务。更多,5,2026年1月11,,,,否,感谢太粉对我们的认可~好的产品，好的服务是赢得客户尊敬的基础，但我们不会仅仅满足于此。感谢您对我们师傅的肯定，相信师傅也会不断的提高技能，为您带去更优质的服务。更多
r_1771737727467_16,tmall,,,匿名买家2026年1月29日已购：JPCD6E-02-B-NF1 14套 白色00该用户未填写评价内容21天后追评：还没有安装很大一台希望好用商家回复：感谢太粉的信任，亲爱的家人，我在包装箱里静静期待与您见面的那一天。一定要记得拨打全国服务热线952315提前预约，好让安装技师哥哥如期把我装上台面哦。更多,5,2026年1月29,,还没有安装很大一台希望好用商家回复：感谢太粉的信任，亲爱的家人，我在包装箱里静静期待与您见面的那一天。一定要记得拨打全国服务热线952315提前预约，好让安装技师哥哥如期把我装上台面哦。更多,,否,感谢太粉的信任，亲爱的家人，我在包装箱里静静期待与您见面的那一天。一定要记得拨打全国服务热线952315提前预约，好让安装技师哥哥如期把我装上台面哦。更多
r_1771737727467_17,tmall,鸭**,,鸭**72025年12月21日已购：JPCD6E-02-B-NF1 14套 白色00洗碗机到货了，师傅主动联系安装，准时到达，安装过程很快，颜值挺高的商家回复：太粉大人，感谢您在万千选择中坚定的选择我们~相信我们的产品不会让您失望~方小太的产品颜值和实力并存，很不错的呢~更多,5,2025年12月21,,,,否,太粉大人，感谢您在万千选择中坚定的选择我们~相信我们的产品不会让您失望~方小太的产品颜值和实力并存，很不错的呢~更多
r_1771737727467_18,tmall,别**啊,,别**啊2026年1月24日已购：JPCD6E-02-B-NF1 14套 白色00该用户觉得商品非常好，给出5星好评14天后追评：东西非常不错，颜色非常搭配，安装师傅非常有耐心！商家回复：方太品牌文化以“做一个懂生活的人”的理念为核心，不仅关注产品创新和功能性，更注重与用户的情感连接和共同成长。我们相信，品质是企业的生命，您的满意是我们最大的动力。更多,5,2026年1月24,,东西非常不错，颜色非常搭配，安装师傅非常有耐心！商家回复：方太品牌文化以“做一个懂生活的人”的理念为核心，不仅关注产品创新和功能性，更注重与用户的情感连接和共同成长。我们相信，品质是企业的生命，您的满意是我们最大的动力。更多,,否,方太品牌文化以“做一个懂生活的人”的理念为核心，不仅关注产品创新和功能性，更注重与用户的情感连接和共同成长。我们相信，品质是企业的生命，您的满意是我们最大的动力。更多
r_1771737727467_19,tmall,态**,,态**52025年12月11日已购：JPCD6E-02-B-NF1 14套 白色030我一开始买了水槽洗碗机因为位置关系后面再三又考虑买了嵌入式洗碗机，原来没有留好位置我的安装师傅寇师傅非常负责任给我改装橱柜柜门也帮我锯了改装特别满意，也谢谢我的销售她叫竹青。三两个碗我也不想洗，以后就解放双手了。商家回复：亲爱的太粉~~看到你的评价，方小太开心得都要跳起来了☆⌒(＞。≪)期待您的再次评价！我们承诺会以更好更快的服务，回馈我们的顾客，也期待着您将来为我们的发展提供宝贵的意见，谢谢您的支持呢！更多,5,2025年12月11,,,,否,亲爱的太粉~~看到你的评价，方小太开心得都要跳起来了☆⌒(＞。≪)期待您的再次评价！我们承诺会以更好更快的服务，回馈我们的顾客，也期待着您将来为我们的发展提供宝贵的意见，谢谢您的支持呢！更多
r_1771737727467_20,tmall,大**买,,大**买2026年1月18日已购：JPCD12E-NT01S 14套 黑色00该用户未填写评价内容20天后追评：尺寸刚刚好，颜值高，等正式用了看如何商家回复：感谢太粉的选择~当您把信任交予给我们的时候，我们相信您买到的不只是一件商品，更多的是一份保障，一份品位。后续有任何问题都可以随时联系我们哦~更多,5,2026年1月18,,尺寸刚刚好，颜值高，等正式用了看如何商家回复：感谢太粉的选择~当您把信任交予给我们的时候，我们相信您买到的不只是一件商品，更多的是一份保障，一份品位。后续有任何问题都可以随时联系我们哦~更多,,否,感谢太粉的选择~当您把信任交予给我们的时候，我们相信您买到的不只是一件商品，更多的是一份保障，一份品位。后续有任何问题都可以随时联系我们哦~更多
r_1771737727467_21,tmall,兰**,,兰**n2026年1月16日已购：JPCD12E-NT01S 14套 黑色05洗碗柜很不错，今晚洗了特别干净。商家回复：感谢太粉的信任，虽然不能亲眼见到您喜悦的表情，但我们依然深深感受到了您对于咱们产品的喜爱，相信我们会越来越好的。宝贝使用过程中有任何疑问，请及时联系我们在线客服哦~~真诚期待您的下次光临。更多,5,2026年1月16,,,,否,感谢太粉的信任，虽然不能亲眼见到您喜悦的表情，但我们依然深深感受到了您对于咱们产品的喜爱，相信我们会越来越好的。宝贝使用过程中有任何疑问，请及时联系我们在线客服哦~~真诚期待您的下次光临。更多
r_1771737727467_22,tmall,**,,t**k2026年1月1日已购：JPCD6E-02-B-NF1 14套 白色00该用户未填写评价内容18天后追评：已经安装完成了，师傅提供安装，颜值杠杠的，期待使用效果商家回复：感谢太粉的选择~当您把信任交予给我们的时候，我们相信您买到的不只是一件商品，更多的是一份保障，一份品位。后续有任何问题都可以随时联系我们哦~更多,5,2026年1月1,,已经安装完成了，师傅提供安装，颜值杠杠的，期待使用效果商家回复：感谢太粉的选择~当您把信任交予给我们的时候，我们相信您买到的不只是一件商品，更多的是一份保障，一份品位。后续有任何问题都可以随时联系我们哦~更多,,否,感谢太粉的选择~当您把信任交予给我们的时候，我们相信您买到的不只是一件商品，更多的是一份保障，一份品位。后续有任何问题都可以随时联系我们哦~更多
r_1771737727467_23,tmall,愤**胖,,愤**胖2025年11月12日已购：JPCD12E-NT01S 14套 黑色7146这款洗碗机颜值真不错，师傅安装也快，服务还贴心，在厨房用着挺香的。主要是大小也是巧了，严丝合缝😄商家回复：方太的每一点成长，都离不开太粉的包容与陪伴。我们会保持敬畏之心，严抓产品品质，用心应对每一份需求，把安心与便捷传递给您。感谢同行，祝您生活舒心如意～更多,5,2025年11月12,,,,否,方太的每一点成长，都离不开太粉的包容与陪伴。我们会保持敬畏之心，严抓产品品质，用心应对每一份需求，把安心与便捷传递给您。感谢同行，祝您生活舒心如意～更多
r_1771737727467_24,tmall,彩**蛮,,彩**蛮2025年12月7日已购：JPCD12E-NT01S 14套 黑色01该用户觉得商品非常好，给出5星好评3天后追评：客服小姐姐很细心解答，安装师傅专业高效，物流非常快，方太值得信赖，点赞👍👍👍商家回复：太开心收到您对安装师傅的夸赞！能得到您的肯定，我们真的特别感动～ 后续使用中若有任何需要售后支持的地方，随时告知，我们会全力为您解决。欢迎常来回购，祝您使用愉快！更多,5,2025年12月7,,客服小姐姐很细心解答，安装师傅专业高效，物流非常快，方太值得信赖，点赞👍👍👍商家回复：太开心收到您对安装师傅的夸赞！能得到您的肯定，我们真的特别感动～ 后续使用中若有任何需要售后支持的地方，随时告知，我们会全力为您解决。欢迎常来回购，祝您使用愉快！更多,,否,太开心收到您对安装师傅的夸赞！能得到您的肯定，我们真的特别感动～ 后续使用中若有任何需要售后支持的地方，随时告知，我们会全力为您解决。欢迎常来回购，祝您使用愉快！更多
r_1771737727467_25,tmall,嗨**来,,嗨**来2025年12月30日已购：JPCD12E-NT01S 14套 黑色00该用户未填写评价内容57天后追评：做了好久的攻略，最后选择了方太，14套的容量，可以四口之家一天的碗。非常的nice！商家回复：得此美言甚是欢喜，如沐春风在心间！每一个评价都是最真实的体验，因为有您，让我们懂得幸福，感谢您这么用心的爱着我们的产品。后期如果有任何问题都可以联系咱家客服或者拨打服务热线：952315。更多,5,2025年12月30,,做了好久的攻略，最后选择了方太，14套的容量，可以四口之家一天的碗。非常的nice！商家回复：得此美言甚是欢喜，如沐春风在心间！每一个评价都是最真实的体验，因为有您，让我们懂得幸福，感谢您这么用心的爱着我们的产品。后期如果有任何问题都可以联系咱家客服或者拨打服务热线：952315。更多,,否,得此美言甚是欢喜，如沐春风在心间！每一个评价都是最真实的体验，因为有您，让我们懂得幸福，感谢您这么用心的爱着我们的产品。后期如果有任何问题都可以联系咱家客服或者拨打服务热线：952315。更多
r_1771737727467_26,tmall,京**,,京**12026年1月29日已购：JPCD12E-NT01S 14套 黑色01师傅耐性很好，很细心，装好很细心教我怎么用商家回复：也许所有时光里的等待，都是一场美丽缘分的延续，正如我们的相遇一样，或许有点迟，但是很美！给师傅一个大大的赞！未来有多美，我不知道，但是有我的生活会更美(๑*◡*๑)~~更多,5,2026年1月29,,,,否,也许所有时光里的等待，都是一场美丽缘分的延续，正如我们的相遇一样，或许有点迟，但是很美！给师傅一个大大的赞！未来有多美，我不知道，但是有我的生活会更美(๑*◡*๑)~~更多
r_1771737727467_28,tmall,**,,e**12025年12月3日已购：JPCD12E-NT01S 14套 黑色03洗碗机很漂亮，师傅上门服务专业贴心，很满意的一次购物  洗碗机内部容量很大，可以放锅商家回复：感谢太粉对我们的认可~好的产品，好的服务是赢得客户尊敬的基础，但我们不会仅仅满足于此。感谢您对我们师傅的肯定，相信师傅也会不断的提高技能，为您带去更优质的服务。更多,5,2025年12月3,,,,否,感谢太粉对我们的认可~好的产品，好的服务是赢得客户尊敬的基础，但我们不会仅仅满足于此。感谢您对我们师傅的肯定，相信师傅也会不断的提高技能，为您带去更优质的服务。更多
r_1771737727467_29,tmall,徐**倩,,徐**倩2025年12月23日已购：JPCD12E-NT01S 14套 黑色00该用户未填写评价内容17天后追评：方太大品牌了 在温州有名的 期待使用效果商家回复：感谢太粉的选择~当您把信任交予给我们的时候，我们相信您买到的不只是一件商品，更多的是一份保障，一份品位。后续有任何问题都可以随时联系我们哦~更多,5,2025年12月23,,方太大品牌了 在温州有名的 期待使用效果商家回复：感谢太粉的选择~当您把信任交予给我们的时候，我们相信您买到的不只是一件商品，更多的是一份保障，一份品位。后续有任何问题都可以随时联系我们哦~更多,,否,感谢太粉的选择~当您把信任交予给我们的时候，我们相信您买到的不只是一件商品，更多的是一份保障，一份品位。后续有任何问题都可以随时联系我们哦~更多
r_1771737727467_30,tmall,脸**子,,脸**子2025年12月13日已购：JPCD12E-NT01S 14套 黑色00该用户觉得商品非常好，给出5星好评3天后追评：厨房的一套都是选择了方太～～洗碗机颜值很高！面板质感无敌～～新装还未使用～期待😍商家回复：感谢太粉的选择~当您把信任交予给我们的时候，我们相信您买到的不只是一件商品，更多的是一份保障，一份品位。后续有任何问题都可以随时联系我们哦~更多,5,2025年12月13,,厨房的一套都是选择了方太～～洗碗机颜值很高！面板质感无敌～～新装还未使用～期待😍商家回复：感谢太粉的选择~当您把信任交予给我们的时候，我们相信您买到的不只是一件商品，更多的是一份保障，一份品位。后续有任何问题都可以随时联系我们哦~更多,,否,感谢太粉的选择~当您把信任交予给我们的时候，我们相信您买到的不只是一件商品，更多的是一份保障，一份品位。后续有任何问题都可以随时联系我们哦~更多
