ID,平台,用户昵称,用户等级,评论内容,评分,日期,SKU,追加评论,追加日期,有图片,商家回复
r_1771737727476_283,tmall,爱**帅,,爱**帅2024年5月5日已购：JPCD12E-NT01S 13套 黑色110声音大小：音量不大 清洗容量：初次洗还可以 其他特色：很漂亮 清洁很好商家回复：北上看到的冰川是您，南下追寻的极光是您，万千人中走过，即便近视也能一眼望到您。国民品牌，真材实料，售后无忧，您就妥妥的用吧！今后使用中有任何问题都可以联系我们在线客服，您的事就是我们的事，我们会第一时间为您解决的！ 更多,5,2024年5月5,,,,否,北上看到的冰川是您，南下追寻的极光是您，万千人中走过，即便近视也能一眼望到您。国民品牌，真材实料，售后无忧，您就妥妥的用吧！今后使用中有任何问题都可以联系我们在线客服，您的事就是我们的事，我们会第一时间为您解决的！ 更多
r_1771737727476_284,tmall,爱**,,爱**22024年12月19日已购：JPCD12E-NT01S 13套 黑色00该用户未填写评价内容19天后追评：好商家回复：感谢太粉的选择，短短的几个字我们也可以开心很久，我们一直希望能做好产品和服务，让大家认可，觉得值，也许这就够了。成长路上有您的支持一定会更加的优秀，也会更加用心的服务好每一位选择我们的买家。 更多,5,2024年12月19,,好商家回复：感谢太粉的选择，短短的几个字我们也可以开心很久，我们一直希望能做好产品和服务，让大家认可，觉得值，也许这就够了。成长路上有您的支持一定会更加的优秀，也会更加用心的服务好每一位选择我们的买家。 更多,,否,感谢太粉的选择，短短的几个字我们也可以开心很久，我们一直希望能做好产品和服务，让大家认可，觉得值，也许这就够了。成长路上有您的支持一定会更加的优秀，也会更加用心的服务好每一位选择我们的买家。 更多
r_1771737727476_285,tmall,爱**,,爱**l2025年5月14日已购：JPCD12E-NT01S 13套 黑色01该用户未填写评价内容60天后追评：买了放很久，刚安装上去，13套的刚好够小家庭使用，不占用太大空间。还不错商家回复：收到您的好评太开心啦！我们会始终坚持品质，也希望您能将我们的产品推荐给更多需要的朋友，感谢您的支持！更多,5,2025年5月14,,买了放很久，刚安装上去，13套的刚好够小家庭使用，不占用太大空间。还不错商家回复：收到您的好评太开心啦！我们会始终坚持品质，也希望您能将我们的产品推荐给更多需要的朋友，感谢您的支持！更多,,否,收到您的好评太开心啦！我们会始终坚持品质，也希望您能将我们的产品推荐给更多需要的朋友，感谢您的支持！更多
r_1771737727476_286,tmall,,,匿名买家2025年6月27日已购：JPCD12E-NT01S 14套 黑色173外观漂亮大气，方太品牌的质量值得放心，客服热心服务好，安装师傅敬业专业。给新家添置的，非常非常满意！👍好评～清洁很好商家回复：衷心感谢您对方太服务的肯定！我们始终相信，好的产品要配好的服务，您满意的笑容就是我们最大的追求。我们会继续保持这样的服务水准，让更多顾客享受到舒适的购物体验！更多,5,2025年6月27,,,,否,衷心感谢您对方太服务的肯定！我们始终相信，好的产品要配好的服务，您满意的笑容就是我们最大的追求。我们会继续保持这样的服务水准，让更多顾客享受到舒适的购物体验！更多
r_1771737727477_287,tmall,,,匿名买家2024年4月19日已购：JPCD12E-NT01S 13套 黑色213方太洗碗机安装完成，售前售后客服热情专业都很给力，师傅手艺好，我很满意，全五星好评。 声音大小：轻 清洗容量：大 清洁很好商家回复：高山流水遇知音，初初相见便倾心。岁月在风的诗里，时光被折进纸里，星光溜进梦里，而您对方太的喜欢藏在我的心里。 更多,5,2024年4月19,,,,否,高山流水遇知音，初初相见便倾心。岁月在风的诗里，时光被折进纸里，星光溜进梦里，而您对方太的喜欢藏在我的心里。 更多
r_1771737727477_288,tmall,,,匿名买家2024年5月23日已购：JPCD12E-NT01S 13套 黑色315洗碗机本身不错  洗碗的空间也还可以 两个人在家做饭够用就是放锅的话就会有点拥挤，最好的自己把锅给刷了 但是这家有特别严重的售后问题 首先买之前告诉我安装费不贵 配件都是明码标价的，但是安装当天我不在家，我女朋友在家的时候最后收了300。说是一百多的配件费  一百多的安装费，我女朋友当时就感觉价格不对但是她女生就没敢要具体的收据，然后问了客服说能给退安装费我们也就没说什么。结果我找客服的时候，就出现了价格对不上， 有两个师傅（实际只来了一个人）一个官方的一个外包的 最后告诉我退不了，好在我提前付款时备注了。最好他们也没弄清出价格  第二就是618价保，买之前告诉我等618的时间会把购买的差价退给我，我都说了之前没在618买过大件 所以我对价格也不是很懂，但是今天我申请价保的时候告诉我平台的价格优惠不参与，但是618打头不就是在平台的优惠卷吗。 他家的售前售后过于混乱，建议买之前自己关注的点一定要自己问清楚，接受了再买清洁很好商家回复：亲爱的用户，一定是有误会给您造成不好的体验了。这边安排了专属客服协助解决您的问题，请您注意接听电话哦！商品价格会随着市场价格波动都会有所起伏，根据店铺保价政策，您可在订单商品下单30天内申请价保。若有任何疑问，欢迎咨询在线客服，感谢您的支持！更多22天后追评：价保问题解决了 但是还是没有淘宝的补贴 只能补商品本身的差价商家回复：尊敬的太粉您好，抱歉给您的这次购物留下小小的遗憾，下次我们会做得更好。您后续有任何问题都可以联系我们在线客服解决哦。祝您生活愉快！更多,5,2024年5月23,,价保问题解决了 但是还是没有淘宝的补贴 只能补商品本身的差价商家回复：尊敬的太粉您好，抱歉给您的这次购物留下小小的遗憾，下次我们会做得更好。您后续有任何问题都可以联系我们在线客服解决哦。祝您生活愉快！更多,,否,亲爱的用户，一定是有误会给您造成不好的体验了。这边安排了专属客服协助解决您的问题，请您注意接听电话哦！商品价格会随着市场价格波动都会有所起伏，根据店铺保价政策，您可在订单商品下单30天内申请价保。若有任何疑问，欢迎咨询在线客服，感谢您的支持！更多22天后追评：价保问题解决了 但是还是没有淘宝的补贴 只能补商品本身的差价商家回复：尊敬的太粉您好，抱歉给您的这次购物留下小小的遗憾，下次我们会做得更好。您后续有任何问题都可以联系我们在线客服解决哦。祝您生活愉快！更多
r_1771737727477_289,tmall,**秋,,s**秋2024年6月8日已购：JPCD12E-NT01S 13套 黑色674非常好用！荣升为爱用家电第一名！买之前挑花眼，实际上认准方太的强排渣和气泡洗就足够了。现在洗碗变成一种乐趣，幸福感爆棚。可惜我家只装得下13套的，各位看官买大不买小啊。 安装，设计，售后的师傅也很给力，响应速度很快，感觉我快成为方太的精神股东了。所以能不能再给我送一套洗涤套装啊？😂😂😂  声音大小：厨房门一关，没啥感觉。  清洗容量：13套，两个人爱用碗盘杯一天的量正好。  其他特色：质感不错。清洁很好7天后追评：家里的抽烟机和燃气灶也是方太的😂😂😂商家回复：尊敬的太粉您好，抱歉给您的这次购物留下小小的遗憾，下次我们会做得更好。您后续有任何问题都可以联系我们在线客服解决哦。祝您生活愉快！更多,5,2024年6月8,,家里的抽烟机和燃气灶也是方太的😂😂😂商家回复：尊敬的太粉您好，抱歉给您的这次购物留下小小的遗憾，下次我们会做得更好。您后续有任何问题都可以联系我们在线客服解决哦。祝您生活愉快！更多,,否,尊敬的太粉您好，抱歉给您的这次购物留下小小的遗憾，下次我们会做得更好。您后续有任何问题都可以联系我们在线客服解决哦。祝您生活愉快！更多
r_1771737727477_290,tmall,小**家,,小**家2025年6月10日已购：JPCD12E-NT01S 14套 黑色06方太的产品值得信赖，颜值高，容量也够用，真是太喜欢啦……商家回复：再动听的甜言蜜语，都敌不过您的一份深刻肯定。我们将一如既往的为您提供优质的服务，我们完善的售前、售后服务，将全程为您的愉快购物保驾护航，对待每一位客户都是像对待自己家人一样呢。ヾ(๑╹◡╹)ﾉ更多,5,2025年6月10,,,,否,再动听的甜言蜜语，都敌不过您的一份深刻肯定。我们将一如既往的为您提供优质的服务，我们完善的售前、售后服务，将全程为您的愉快购物保驾护航，对待每一位客户都是像对待自己家人一样呢。ヾ(๑╹◡╹)ﾉ更多
r_1771737727477_291,tmall,真**西,,真**西2024年12月12日已购：JPCD12E-NT01S 13套 黑色02方太的售后真是太棒了！双十一的订单，合理的帮忙延后以及临时调整送货时间，不管是客服还是售后电话，响应速度都很积极，好感➕➕➕  接下来就等安装啦～商家回复：在那么多店铺中选择我们，是缘分，也是我们的荣幸。我们将一如既往的为您提供优质的服务，我们完善的售前、售后服务，将全程为您的愉快购物保驾护航，对待每一位客户都是像对待自己家人一样呢。 更多,5,2024年12月12,,,,否,在那么多店铺中选择我们，是缘分，也是我们的荣幸。我们将一如既往的为您提供优质的服务，我们完善的售前、售后服务，将全程为您的愉快购物保驾护航，对待每一位客户都是像对待自己家人一样呢。 更多
r_1771737727477_292,tmall,,,匿名买家2024年4月25日已购：JPCD12E-NT01S 13套 黑色06客服小田的服务非常到位。机器工作的时候声音也不大，洗得非常干净 。值得推荐。清洁很好商家回复：在那么多店铺中选择我们，是缘分，也是我们的荣幸。好的产品，好的服务是赢得客户尊敬的基础，但我们不会仅仅满足于此。因为专注所以专业，因为专业所以卓越，我们一直在努力打造更好的宝贝， 希望我们的产品能够成为您生活中的小助手！期待您的下次光临！ 更多,5,2024年4月25,,,,否,在那么多店铺中选择我们，是缘分，也是我们的荣幸。好的产品，好的服务是赢得客户尊敬的基础，但我们不会仅仅满足于此。因为专注所以专业，因为专业所以卓越，我们一直在努力打造更好的宝贝， 希望我们的产品能够成为您生活中的小助手！期待您的下次光临！ 更多
r_1771737727477_293,tmall,,,匿名买家2024年10月1日已购：JPCD12E-NT01S 13套 黑色00该用户未填写评价内容41天后追评：差评，安装的工人把我厨房下面的挡板切割了之后，明明尺寸不对，就假模假样的放上去了，多切一次切短一点都不来切，导致我现在门都不能拉关不起来，一关门下面的挡板就掉出来。服务不行商家回复：亲爱的，您先消消气~给您带来不好的体验我们深感抱歉，我们已将您的问题反馈给实地核实处理，请您放心。使用中有任何问题可以随时联系我们，我们会第一时间为您解决的！更多,5,2024年10月1,,差评，安装的工人把我厨房下面的挡板切割了之后，明明尺寸不对，就假模假样的放上去了，多切一次切短一点都不来切，导致我现在门都不能拉关不起来，一关门下面的挡板就掉出来。服务不行商家回复：亲爱的，您先消消气~给您带来不好的体验我们深感抱歉，我们已将您的问题反馈给实地核实处理，请您放心。使用中有任何问题可以随时联系我们，我们会第一时间为您解决的！更多,,否,亲爱的，您先消消气~给您带来不好的体验我们深感抱歉，我们已将您的问题反馈给实地核实处理，请您放心。使用中有任何问题可以随时联系我们，我们会第一时间为您解决的！更多
r_1771737727477_294,tmall,,,匿名买家2024年5月31日已购：JPCD12E-NT01S 13套 黑色08洗碗机很好，解放劳动力清洁很好商家回复：亲爱的，感谢您的选购，要捡起心中的梦，先放下手中的碗，洗碗的任务就交给洗碗机来吧~~~咱们一定不断努力，用更好的产品回报太粉的厚爱~更多,5,2024年5月31,,,,否,亲爱的，感谢您的选购，要捡起心中的梦，先放下手中的碗，洗碗的任务就交给洗碗机来吧~~~咱们一定不断努力，用更好的产品回报太粉的厚爱~更多
r_1771737727477_295,tmall,白**妈,,白**妈2024年11月26日已购：JPCD12E-NT01S 13套 黑色00参加国补，还没到安装阶段，先收货安装后补图，运输用的顺丰，小哥服务非常好商家回复：确认过眼神，你是对的人。相信我们的产品不会让您失望的，后期需要安装了可以拨打我司热线952315预约，24小时热线竭诚为您服务！未来是让人想象不到的，所以才有所期待，我一直在期待着您使用满意~~ 更多,5,2024年11月26,,,,否,确认过眼神，你是对的人。相信我们的产品不会让您失望的，后期需要安装了可以拨打我司热线952315预约，24小时热线竭诚为您服务！未来是让人想象不到的，所以才有所期待，我一直在期待着您使用满意~~ 更多
r_1771737727477_296,tmall,,,匿名买家2024年11月13日已购：JPCD12E-NT01S 13套 黑色00全部买的方太的牌子 相信品牌 服务蛮好的！商家回复：太粉的好评恰似一波暖流留入我们的心田。我们将一如既往的为您提供优质的服务，我们完善的售前、售后服务，将全程为您的愉快购物保驾护航，对待每一位客户都是像对待自己家人一样呢。千万个心愿，无数个祝福，愿您每天有个好心情~~更多,5,2024年11月13,,,,否,太粉的好评恰似一波暖流留入我们的心田。我们将一如既往的为您提供优质的服务，我们完善的售前、售后服务，将全程为您的愉快购物保驾护航，对待每一位客户都是像对待自己家人一样呢。千万个心愿，无数个祝福，愿您每天有个好心情~~更多
r_1771737727477_297,tmall,蓝**,,蓝**62025年6月2日已购：JPCD12E-NT01S 14套 黑色230声音大小：小 清洗容量：三口人日常使用足够 其他特色：消毒柜改洗碗机，完美嵌入！客服和安装师傅很专业，旧橱柜改造解决了不少问题！使用了几次，洗得特别干净，烘干效果也很好，618活动优惠力度大，非常满意的一次购物！ 清洁很好商家回复：喜欢就好，遇到合适的品牌，选到喜欢的产品，确实是令人开心的事。 您把信任交予给我们的时候，我们相信您买到的不只是一件商品，更多的是一份保障，一份品位。 期待与您再次相遇！更多,5,2025年6月2,,,,否,喜欢就好，遇到合适的品牌，选到喜欢的产品，确实是令人开心的事。 您把信任交予给我们的时候，我们相信您买到的不只是一件商品，更多的是一份保障，一份品位。 期待与您再次相遇！更多
r_1771737727477_298,tmall,,,匿名买家2024年4月24日已购：JPCD12E-NT01S 13套 黑色113还没用，不过方太大品牌信得过，颜值也不错，新品还送了2套洗涤套装，客服回复也很快清洁很好商家回复：桃花潭水深千尺，不及太粉送好评~~我们期待您体验之后的分享哦，希望可以得到您的认可。愿您拥一份从容心情，赏一路美好风景！ 更多,5,2024年4月24,,,,否,桃花潭水深千尺，不及太粉送好评~~我们期待您体验之后的分享哦，希望可以得到您的认可。愿您拥一份从容心情，赏一路美好风景！ 更多
r_1771737727477_299,tmall,,,匿名买家2024年7月4日已购：JPCD12E-NT01S 13套 黑色01没想到大牌子也这样，刚开始给我们说的我们就自己买了水管价格便宜，现在师傅上门说原装商家送的水管长度不够导致加钱买，开始只叫我们测量尺寸，找客服的时候各种推辞说法，那你早叫我们备一个不就行了吗，还另外出费用，总体效果大牌子还这么差劲，说好的送的杯子也没有收到清洁不太好商家回复：亲爱的太粉大人，我们的安装服务是免费的哦（不含烟机出风口开孔、灶具台面开孔、拆旧机、拆吊顶，标配以外的零配件，以上需另行支付相关费用。）因安装环境的不同，有些家庭需要用到一些额外的配件或者服务。我们已安排工作人员与您联系排查，请您保持手机畅通哦。后续有任何问题您可以随时联系我们在线客服或拨打952315售后热线~我们将竭诚为您服务~祝您生活愉快~更多6天后追评：卖家后续处理了，因昨天没有商量好，现在处理好了，感谢商家回复：得此美言甚是欢喜，如沐春风在心间！每一个评价都是最真实的体验，因为有您，让我们懂得幸福，感谢您这么用心的爱着我们的产品。后期如果有任何问题都可以联系咱家客服或者拨打服务热线：952315。更多,5,2024年7月4,,卖家后续处理了，因昨天没有商量好，现在处理好了，感谢商家回复：得此美言甚是欢喜，如沐春风在心间！每一个评价都是最真实的体验，因为有您，让我们懂得幸福，感谢您这么用心的爱着我们的产品。后期如果有任何问题都可以联系咱家客服或者拨打服务热线：952315。更多,,否,亲爱的太粉大人，我们的安装服务是免费的哦（不含烟机出风口开孔、灶具台面开孔、拆旧机、拆吊顶，标配以外的零配件，以上需另行支付相关费用。）因安装环境的不同，有些家庭需要用到一些额外的配件或者服务。我们已安排工作人员与您联系排查，请您保持手机畅通哦。后续有任何问题您可以随时联系我们在线客服或拨打952315售后热线~我们将竭诚为您服务~祝您生活愉快~更多6天后追评：卖家后续处理了，因昨天没有商量好，现在处理好了，感谢商家回复：得此美言甚是欢喜，如沐春风在心间！每一个评价都是最真实的体验，因为有您，让我们懂得幸福，感谢您这么用心的爱着我们的产品。后期如果有任何问题都可以联系咱家客服或者拨打服务热线：952315。更多
r_1771737727477_300,tmall,能**人,,能**人2025年2月18日已购：JPCD12E-NT01S 13套 黑色1133方太大品牌售后很好，而且还单独开视频给你讲解产品怎么使用真的很用心了，然后师傅上门测量安装整体下来挺不错的，还没开始用，看起来很高级，挑了很多洗碗机，选择品牌的不会错 后续追评使用效果清洁很好商家回复：非常感谢太粉的宝贵评价！我们期待您体验之后的分享哦，希望可以得到您的认可。觉得好用的话，就多分享下您的感受和心得，多多推荐给亲朋好友。更多,5,2025年2月18,,使用效果清洁很好商家回复：非常感谢太粉的宝贵评价！我们期待您体验之后的分享哦，希望可以得到您的认可。觉得好用的话，就多分享下您的感受和心得，多多推荐给亲朋好友。更多,,否,非常感谢太粉的宝贵评价！我们期待您体验之后的分享哦，希望可以得到您的认可。觉得好用的话，就多分享下您的感受和心得，多多推荐给亲朋好友。更多
r_1771737727477_301,tmall,**咪,,k**咪2024年4月18日已购：JPCD12E-NT01S 13套 黑色015声音大小：工作时声音可以接受 其他特色：安装服务到位没有多余隐形消费，客服回复及时，态度满分 清洁很好商家回复：相对两相知，清如水兮明如镜，寸心澈而映。好的产品，好的服务是赢得客户尊敬的基础，但我们不会仅仅满足于此。因为专注所以专业，因为专业所以卓越，我们一直在努力打造更好的宝贝， 希望我们的产品能够成为您生活中的小助手！期待您的下次光临！ 更多,5,2024年4月18,,,,否,相对两相知，清如水兮明如镜，寸心澈而映。好的产品，好的服务是赢得客户尊敬的基础，但我们不会仅仅满足于此。因为专注所以专业，因为专业所以卓越，我们一直在努力打造更好的宝贝， 希望我们的产品能够成为您生活中的小助手！期待您的下次光临！ 更多
r_1771737727477_302,tmall,用**,,用**52025年6月21日已购：JPCD12E-NT01S 14套 黑色07该用户未填写评价内容23天后追评：解放双手的神器，后悔没早买方太洗碗机！吃完饭再也不用为谁洗碗发愁了，统统丢进去，锅碗瓢盆都能洗得锃亮。嵌入式的设计和我家橱柜完美融合，一点不占地方。方太小助手小布超级细心贴心，售前售后满分，安装工作人员也非常辛苦，做得很好！商家回复：世界这么大，能遇见，不容易，我们珍惜选择我们的每一位太粉。我们会继续保持，不断变得更棒的!更多,5,2025年6月21,,解放双手的神器，后悔没早买方太洗碗机！吃完饭再也不用为谁洗碗发愁了，统统丢进去，锅碗瓢盆都能洗得锃亮。嵌入式的设计和我家橱柜完美融合，一点不占地方。方太小助手小布超级细心贴心，售前售后满分，安装工作人员也非常辛苦，做得很好！商家回复：世界这么大，能遇见，不容易，我们珍惜选择我们的每一位太粉。我们会继续保持，不断变得更棒的!更多,,否,世界这么大，能遇见，不容易，我们珍惜选择我们的每一位太粉。我们会继续保持，不断变得更棒的!更多
r_1771737727477_303,tmall,**,,T**42024年4月2日已购：白色08第一次买朋友推荐 非常喜欢商家回复：一个温和的笑容，一个满意的评语，像那冬日暖阳，夏日清风，给予了我们希望与动力，感恩一路相伴的您！更多,5,2024年4月2,,,,否,一个温和的笑容，一个满意的评语，像那冬日暖阳，夏日清风，给予了我们希望与动力，感恩一路相伴的您！更多
r_1771737727477_304,tmall,爱**头,,爱**头2024年12月3日已购：JPCD12E-NT01S 13套 黑色00严丝合缝 安装师傅靠谱效率高 东西也很漂亮！清洁很好商家回复：亲爱的太粉~我们很高兴听到我们的安装师傅受到了你的赞赏。我们的师傅都是经过专业培训，经验丰富的技术人员呢~更多,5,2024年12月3,,,,否,亲爱的太粉~我们很高兴听到我们的安装师傅受到了你的赞赏。我们的师傅都是经过专业培训，经验丰富的技术人员呢~更多
r_1771737727477_305,tmall,**员,,D**员2025年7月6日已购：JPCD12E-NT01S 14套 黑色05只要放的角度别太平，基本都洗得很干净。终于排除万难搞上洗碗机了，哈哈！而且可以放下家里五十多厘米的大炒锅！ ps，谢谢客服洋芋，618很贴心，态度好又专业清洁很好商家回复：您的喜悦能感染到我们，并为之心旷神怡。好品质的宝贝都会在时间的验证下证明它独特的价值。相信我们的宝贝不会让亲爱的失望。更多,5,2025年7月6,,,,否,您的喜悦能感染到我们，并为之心旷神怡。好品质的宝贝都会在时间的验证下证明它独特的价值。相信我们的宝贝不会让亲爱的失望。更多
r_1771737727477_306,tmall,**宝,,G**宝2025年8月7日已购：JPCD12E-NT01S 14套 黑色2141清洗容量：很大 声音大小：小 其他特色：很好不错不错  材质结实，手感好，很得劲，物流也快，性价比很高，值得购买  洗碗机质量👍超棒，安装师傅服务周到🔥，发货速度💨也很快。 清洁很好商家回复：哇塞！看到您的好评，我们整个团队都欢呼雀跃了！您真是太会夸人了，让我们的自信心都爆棚了！不过说实话，我们还是会保持谦逊和努力，继续为您提供超棒的服务和体验哦！更多,5,2025年8月7,,,,否,哇塞！看到您的好评，我们整个团队都欢呼雀跃了！您真是太会夸人了，让我们的自信心都爆棚了！不过说实话，我们还是会保持谦逊和努力，继续为您提供超棒的服务和体验哦！更多
